title0,title1,title2,title3
Consectetur ipsum tempora numquam velit.,Ipsum ut aliquam sit.,Consectetur aliquam consectetur consectetur magnam aliquam ut etincidunt.,Labore modi labore ipsum numquam porro.
Quiquia ipsum labore porro dolor.,Amet voluptatem velit ut.,Labore modi quaerat quiquia modi amet dolore.,Dolore non dolore quiquia amet magnam neque quaerat.
Quiquia modi voluptatem ut est non est dolorem.,Porro sit quiquia dolore dolorem.,Modi voluptatem ipsum magnam aliquam porro voluptatem.,Tempora non ut etincidunt eius sit.
Quaerat numquam modi numquam numquam sed labore ut.,Dolorem dolore aliquam sit amet.,Quiquia sed ipsum adipisci dolorem amet.,Voluptatem sit velit etincidunt.
Adipisci consectetur velit velit dolore quisquam porro.,Ipsum labore quisquam adipisci etincidunt quiquia consectetur velit.,Etincidunt neque porro dolor dolor ipsum dolore sed.,Dolor amet adipisci amet ut non.
