title0,title1,title2
Etincidunt quaerat labore tempora sit.,Porro dolor dolor eius.,Modi consectetur ipsum labore adipisci.
Amet magnam sit ipsum.,Ipsum quiquia ut quisquam etincidunt est velit sit.,Porro porro quisquam dolore dolorem dolor.
Etincidunt sed modi ipsum dolore.,Magnam non dolore porro dolor modi magnam.,Neque tempora aliquam labore velit etincidunt ipsum.
Modi dolor numquam eius ut modi amet consectetur.,Sit aliquam sed non adipisci.,Labore ipsum dolore porro.
Est quaerat velit numquam etincidunt.,Porro dolore adipisci quisquam dolor velit.,Velit etincidunt velit ipsum etincidunt est dolore quiquia.
Ipsum neque adipisci dolore magnam amet velit.,Quisquam amet sit consectetur ipsum ut velit.,Quisquam est velit labore ut ipsum tempora non.
