title0,title1,title2,title3
Magnam quaerat numquam etincidunt sed amet.,Adipisci velit sed consectetur magnam velit numquam.,Aliquam ut non numquam quisquam quaerat porro.,Dolorem dolorem velit modi sed.
Adipisci amet sed voluptatem neque adipisci.,Voluptatem non etincidunt quisquam dolorem quiquia neque eius.,Quiquia ut quiquia voluptatem tempora.,Consectetur est quisquam amet.
Numquam consectetur eius quisquam sed.,Sed etincidunt numquam modi dolor sed quisquam.,Magnam neque ut quisquam sed.,Aliquam sit modi labore velit.
Adipisci est quaerat amet.,Amet dolore eius tempora quaerat quisquam magnam.,Adipisci modi sed sed adipisci quisquam voluptatem.,Eius non eius non.
Ut labore velit voluptatem.,Neque adipisci consectetur numquam amet dolor.,Velit quaerat porro dolor ut adipisci.,Eius tempora sed non dolore voluptatem aliquam.
Quisquam sed modi numquam quiquia eius.,Labore eius non porro quisquam est.,Eius est sit adipisci numquam.,Dolore labore aliquam sed.
