title0,title1,title2,title3,title4,title5,title6
Sit quiquia quisquam modi etincidunt etincidunt amet adipisci.,Quaerat etincidunt modi sit.,Tempora velit dolore neque dolore.,Ipsum amet non eius porro est voluptatem.,Ipsum sed sed quiquia quiquia consectetur neque non.,Neque quaerat sed est adipisci dolor dolor dolorem.,Velit eius non dolorem.
Quaerat etincidunt adipisci dolor non.,Aliquam aliquam quisquam amet.,Dolore eius labore velit aliquam aliquam.,Dolore etincidunt porro voluptatem est adipisci labore.,Tempora dolore porro tempora dolor est ut dolore.,Porro modi sed non etincidunt neque labore.,Eius numquam dolore non tempora adipisci voluptatem.
Dolore sed neque ut.,Consectetur dolore modi modi numquam consectetur magnam numquam.,Etincidunt quiquia dolor quaerat consectetur labore quisquam est.,Tempora adipisci sed amet aliquam quiquia dolorem tempora.,Sed quaerat consectetur adipisci.,Eius porro magnam adipisci est dolorem dolorem.,Voluptatem dolor modi ipsum neque voluptatem non ut.
Amet velit modi modi dolor.,Dolor labore dolorem dolor non dolorem.,Modi neque ut eius.,Tempora ut modi porro velit numquam sed dolore.,Ipsum neque quisquam quisquam adipisci ut.,Aliquam magnam porro numquam dolorem.,Est porro neque dolorem consectetur porro.
Adipisci ipsum est numquam ut magnam.,Porro magnam tempora modi quisquam quaerat numquam tempora.,Ipsum quisquam adipisci sed.,Velit eius dolor quiquia neque tempora quisquam.,Velit porro ut labore ut consectetur dolor.,Ut dolor aliquam quisquam modi consectetur.,Numquam amet aliquam porro neque quisquam.
Consectetur dolorem modi porro sit neque etincidunt labore.,Ipsum dolorem quisquam magnam neque tempora sed.,Quisquam numquam quaerat magnam quaerat amet.,Dolore voluptatem quisquam quisquam tempora numquam.,Quiquia quiquia aliquam quisquam.,Modi est eius modi amet velit velit neque.,Dolore non modi quaerat.
