title0,title1
Dolore dolor dolore consectetur ut.,Tempora quisquam velit numquam.
Porro voluptatem tempora numquam eius.,Dolorem sed sit quaerat.
Neque amet labore aliquam numquam numquam adipisci.,Etincidunt adipisci ut quiquia magnam numquam dolorem numquam.
Aliquam eius dolorem porro sed aliquam adipisci non.,Voluptatem est ut porro.
Sit neque labore modi est labore eius.,Quisquam velit numquam non eius porro.
Etincidunt voluptatem consectetur ut labore velit ut.,Voluptatem modi quaerat etincidunt.
Numquam labore quisquam dolorem dolorem etincidunt magnam.,Velit dolor adipisci adipisci ut.
