title0,title1,title2,title3,title4,title5
Sit amet ipsum numquam amet sit.,Quisquam voluptatem non numquam eius porro tempora non.,Eius aliquam ut est voluptatem.,Dolorem dolorem porro quisquam.,Aliquam tempora dolore quaerat sed numquam ut.,Adipisci dolor ipsum neque porro quaerat.
Dolor dolor amet neque.,Magnam labore voluptatem est consectetur etincidunt numquam quiquia.,Quiquia adipisci non labore est labore modi.,Etincidunt dolorem amet sit modi est.,Ipsum quisquam sed numquam dolore ut ut consectetur.,Dolore non eius consectetur velit amet labore dolore.
Porro labore numquam quaerat.,Dolorem non ut dolor ipsum amet est est.,Dolore etincidunt numquam tempora porro ipsum.,Dolor modi non porro.,Non ut eius modi eius eius amet modi.,Magnam non aliquam quaerat.
Eius quiquia labore amet.,Quisquam neque labore quiquia etincidunt numquam quisquam.,Sed modi porro est numquam numquam eius.,Eius magnam sed magnam.,Est quiquia modi modi quisquam neque est amet.,Ipsum eius porro non.
Neque quisquam non labore ipsum eius quaerat.,Modi ipsum etincidunt modi quaerat labore ipsum.,Tempora quisquam dolorem quaerat quiquia.,Quaerat consectetur porro etincidunt dolor quisquam etincidunt dolor.,Quiquia etincidunt ipsum aliquam ut.,Quiquia quisquam labore voluptatem.
Dolore neque consectetur ut quisquam.,Velit consectetur velit quisquam est.,Amet quiquia est neque quaerat consectetur etincidunt.,Sit velit dolorem adipisci tempora.,Tempora neque neque quaerat.,Non ipsum adipisci ut tempora.
Velit magnam consectetur porro quisquam sed consectetur.,Quisquam voluptatem dolore numquam.,Voluptatem sit dolor consectetur modi dolor quiquia.,Ipsum quaerat etincidunt sed non.,Porro dolor labore quiquia quiquia.,Eius dolorem numquam ipsum sit.
