title0,title1,title2,title3
Quisquam est amet eius amet porro adipisci.,Etincidunt neque non porro dolore voluptatem.,Magnam non tempora tempora quiquia.,Eius dolor neque magnam eius.
Sit etincidunt etincidunt labore modi dolore sit non.,Modi quiquia dolor neque dolore tempora.,Sit consectetur tempora etincidunt voluptatem.,Dolorem amet non tempora voluptatem numquam modi ut.
Non quisquam porro quiquia non ut.,Porro etincidunt non quaerat etincidunt quisquam.,Quaerat tempora labore numquam etincidunt eius.,Voluptatem ut quiquia dolorem numquam dolor labore.
Quiquia amet porro aliquam consectetur tempora modi.,Neque quaerat consectetur dolorem.,Adipisci ut modi adipisci modi.,Adipisci labore est dolor non.
Dolor ut dolore consectetur quisquam magnam neque dolore.,Modi labore labore quiquia.,Sed magnam dolor aliquam sed.,Eius voluptatem modi etincidunt dolor dolor dolor.
Dolorem tempora est neque voluptatem.,Velit est labore aliquam magnam quisquam numquam quaerat.,Quisquam voluptatem tempora eius consectetur etincidunt voluptatem sed.,Non ut tempora est magnam.
Sed eius eius aliquam magnam amet.,Etincidunt dolorem sit dolore eius amet quaerat sit.,Voluptatem est eius quisquam.,Dolorem ipsum labore velit sit amet.
Non dolore modi non ut etincidunt consectetur labore.,Aliquam modi est sit porro sit velit.,Quisquam porro aliquam voluptatem velit dolor aliquam velit.,Neque dolore sed porro est modi dolore voluptatem.
Labore dolorem dolorem tempora.,Ipsum quaerat modi magnam velit est quisquam.,Modi amet eius non adipisci tempora.,Ipsum magnam non quiquia magnam quaerat amet.
